"Multiply Labs","Robots for cell therapy manufacturing.","https://multiplylabs.com/","https://www.linkedin.com/company/multiply-labs/","Healthcare,Manufacturing,Pharma","Robot or automated system","No","Automated system – Other","","","","",""
"Mytra","Warehouse storage system and robots.","https://mytra.ai/","https://www.linkedin.com/company/mytra-ai/","Warehousing and storage","Robot or automated system","No","Modular or standardized storage and retrieval system","","","","",""
"Naio Technologies","","http://naio-technologies.com/","https://www.linkedin.com/company/na-o-technologies/","Agriculture and farming","Robot or automated system","No","Mobile robot – Wheeled – Off-road","","","","",""
"National Robotics Engineering Center","Develops custom robotic technologies from concept to commercialization.","https://www.nrec.ri.cmu.edu/index.html","https://www.linkedin.com/company/national-robotics-engineering-center-nrec/","Research,Robotics development","On-demand robotics or automation development","No","","","","","",""
"Native Robotics","No-code programming for palletizing robots.","https://native-robotics.com/","https://www.linkedin.com/company/native-robotics/","Material handling","Software","No","","","","","",""
"Nauticus Robotics, Inc.","Autonomous underwater drones.","https://nauticusrobotics.com/","https://www.linkedin.com/company/nauticus-robotics-inc/","Marine","Hardware component,Robot as a service,Robot or automated system","No","Surface water drone,Underwater drone","","","","",""
"NAVER LABS Corp.","Various robotic platforms.","https://www.naverlabs.com/","https://www.linkedin.com/company/naverlabs/","General-purpose robotics","Autonomous control system,Robot or automated system","No","Humanoid robot – Mobile platform,Mobile manipulator,Mobile robot – Wheeled – Indoor,Robotic arm – Articulated","","","","",""
"Near Earth Autonomy","Custom aerial autonomy solutions.","https://www.nearearth.aero/","https://www.linkedin.com/company/near-earth-autonomy/","Aviation,Defense","On-demand robotics or automation development","No","","","","","",""
"Neobotix","Mobile robots.","https://www.neobotix-roboter.de/","https://www.linkedin.com/company/neobotix/","General-purpose robotics","Robot or automated system","No","Mobile manipulator,Mobile robot – Wheeled – Indoor,Robotic arm – Articulated","","","","",""
"Neocis","Robot for dentistry","https://www.neocis.com/","https://www.linkedin.com/company/neocis/","Healthcare","Robot or automated system","No","Robotic arm – Articulated","","","","",""
"Neros Technologies","Autonomous defense robots.","https://www.neros.tech/","https://www.linkedin.com/company/neros-tech/","Defense","Robot or automated system","No","","","","","",""
"Neubility","Delivery robots.","https://www.neubility.co.kr/","https://www.linkedin.com/company/neubility/","Delivery","Robot or automated system","No","Mobile robot – Wheeled – Outdoor","","","","",""
"NEURA Robotics","Multi-purpose robots. Robotic arms, mobile platforms.","https://www.neura-robotics.com/","https://www.linkedin.com/company/neura-robotics/","General-purpose robotics","Robot or automated system","Yes","Humanoid robot,Mobile manipulator,Mobile robot – Wheeled – Indoor,Robotic arm – Articulated","","","","",""
"Nextera Robotics","Robot for construction site inspection.","https://nexterarobotics.com/","https://www.linkedin.com/company/nextera-robotics/about/","Construction,Inspection","Robot or automated system","Yes","Mobile robot – Tracked,Mobile robot – Wheeled – Off-road","","","","",""
"Neya Systems","Off-road autonomy software.","https://neyarobotics.com/","https://www.linkedin.com/company/neya-systems/","Civil engineering,Construction,Defense,Earthworks,Mining","Software","No","","","","","",""
"Nimble","Robot-powered logistics.","https://www.nimble.ai/","https://www.linkedin.com/company/nimble-robotics/","Warehousing and storage","Robot-powered service","No","Automated system – Other,Hybrid robotic system,Robotic arm – Articulated","","","","",""
"Nimble One","Unconventionally shaped mobile robot.","https://nimbleone.io/","https://www.linkedin.com/company/nimbleone/","General-purpose robotics,Inspection,Maintenance","Robot or automated system","Yes","Inchworm robot – Wheeled","","","","",""
"Niryo","Collaborative desktop robotic arm and compatible components.","https://niryo.com/","https://www.linkedin.com/company/niryo/","Education,Research","Hardware component,Robot or automated system","No","Robotic arm – Articulated","","","","",""
"NODE Robotics","Software for mobile robot autonomy.","https://node-robotics.com/","https://www.linkedin.com/company/node-robotics/","Robotics development","Software","Yes","","","","","",""
"Nomagic","Packaging and material handling robots","https://nomagic.ai/","https://www.linkedin.com/company/nomagic/","Material handling,Packaging","Robot or automated system","Yes","Automated system – Other,Robotic arm – Articulated","","","","",""
"Nordbo Robotics","","https://nordbo-robotics.com/","https://www.linkedin.com/company/nordbo-robotics/","Manufacturing","Robot or automated system","No","Automated system – Other,Robotic arm – Articulated","","","","",""
"Nuro","Sensors and software for autonomous driving.","https://www.nuro.ai/","https://www.linkedin.com/company/nuro-inc./","Delivery,Transportation of goods,Trucking","Autonomous control system","No","Automation retrofit,Mobile robot – Wheeled – Outdoor","","","","",""
"Ocado Technology","Modular storage system and robotic retrieval.","https://ocadogroup.com/solutions/online-grocery/","https://www.linkedin.com/company/ocado-technology/","Retail,Warehousing and storage","Robot or automated system","No","Hybrid robotic system,Modular or standardized storage and retrieval system,Robotic arm – Articulated","","","","",""
"Okibo","Mobile robots for finishing and painting.","https://okibo.com/","https://www.linkedin.com/company/okibo-ltd/","Construction","Robot or automated system","No","Mobile manipulator,Mobile robot – Wheeled – Indoor,Robotic arm – Articulated","","","","",""
"Olis Robotics","Cameras for industrial robot observation.","https://olisrobotics.com/","https://www.linkedin.com/company/olisrobotics/","Robotics management","Hardware component","No","","","","","",""
"Olive Robotics","ROS-powered modular robotic components.","https://www.olive-robotics.com/","https://www.linkedin.com/company/oliverobotics/","Robotics development","Hardware component","Yes","","","","","",""
"Onward Robotics","Robots and software for warehouse operations.","https://onwardrobotics.com/","https://www.linkedin.com/company/onward-robotics/","Warehousing and storage","Robot or automated system,Software","No","Mobile robot – Wheeled – Indoor","","","","",""
"Opentrons Labworks Inc.","Liquid handling robots for scientists.","https://opentrons.com/","https://www.linkedin.com/company/opentrons-labworks-inc./","Life sciences","Robot or automated system","No","Cartesian robot","","","","",""
"Opteran","Machine vision based on biological processes.","https://opteran.com/","https://www.linkedin.com/company/opteran/","Robotic controls,Robotics development","Software","Yes","","","","","",""
"Orbotix Technologies","Autonomous drones and software for defense.","https://orbotix.tech/","https://www.linkedin.com/company/orbotix/","Defense","Robot or automated system,Software","No","Aerial drone – Fixed-wing,Aerial drone – Multirotor","","","","",""
"OTTO by Rockwell Automation","Autonomous mobile platforms and forklifts.","https://ottomotors.com/","https://www.linkedin.com/company/otto-motors/","Material handling,Warehousing and storage","Robot or automated system","Yes","Mobile robot – Wheeled – Indoor","","","","",""
"OttonomyIO","Robots for automated indoor and outdoor delivery.","http://www.ottonomy.io/","https://www.linkedin.com/company/ottonomyio/","Delivery","Robot or automated system","Yes","Mobile robot – Wheeled – Outdoor","","","","",""
"Ouster","Lidar hardware and software.","https://ouster.com/","https://www.linkedin.com/company/ouster/","Automotive,Robotics development","Hardware component,Software","Yes","","","","","",""
"Outrider","Truck autonomy for warehouse, yard operations.","https://www.outrider.ai/","https://www.linkedin.com/company/outridertech/","Material handling,Transportation of goods,Trucking,Yard operations","Autonomous control system","No","Automation retrofit","","","","",""
"Overland AI","Off-road ground autonomy stack.","https://www.overland.ai/","https://www.linkedin.com/company/overland-ai/","Delivery","Autonomous control system","No","Automation retrofit","","","","",""
"Overview AI","Camera and AI for manufacturing defect detection.","https://overview.ai/","https://www.linkedin.com/company/overview-ai/","Manufacturing","Hardware component","No","","","","","",""
"Oxa","Vehicle and sensor agnostic self-driving software.","https://oxa.tech/","https://www.linkedin.com/company/oxauniversalautonomy/","Automotive,Transportation","Software","No","","","","","",""
"Oxipital AI","AI vision software for inspection and robotics control.","https://www.oxipitalai.com/","https://www.linkedin.com/company/oxipital/","Inspection,Robotic controls,Robotics development","Software","Yes","","","","","",""
"PAL Robotics","","https://pal-robotics.com/","https://www.linkedin.com/company/pal-robotics/","General-purpose robotics","Robot or automated system","No","Bipedal robot,Humanoid robot,Humanoid robot – Mobile platform,Mobile manipulator,Mobile robot – Wheeled – Indoor,Robotic arm – Articulated","","","","",""
"Path Robotics","Robotic welding.","https://www.path-robotics.com/","https://www.linkedin.com/company/path-robotics/","Manufacturing","Robot or automated system","No","Automated system – Other,Robotic arm – Articulated","","","","",""
"PDW","Autonomous defense drones.","https://www.pdw.ai/","https://www.linkedin.com/company/pdw-ai/","Defense","Robot or automated system","No","Aerial drone – Multirotor","","","","",""
"Peer Robotics","Mobile platform.","https://www.peerrobotics.ai/","https://www.linkedin.com/company/peer-robotics/","Warehousing and storage","Robot or automated system","Yes","Mobile robot – Wheeled – Indoor","","","","",""
"Percepto","Autonomous drones for inspection.","https://percepto.co/","https://www.linkedin.com/company/perceptoautonomousdrones/","Inspection","Robot or automated system","No","Aerial drone – Multirotor","","","","",""
"Peregrine.ai","Computer vision for dashcams.","https://www.peregrine.ai/","https://www.linkedin.com/company/peregrine-ai/","Transportation,Transportation of goods,Trucking","Software","No","","","","","",""
"Perpetual","Robotic inventory system for healthcare.","https://perpetual.so/","https://www.linkedin.com/company/perpetualsolutions/","Healthcare,Pharma","Robot or automated system","No","Modular or standardized storage and retrieval system","","","","",""
"Petra","Robots for boring and undergrounding utilities.","https://petra.cc/","https://www.linkedin.com/company/petraundergrounding/","Boring,Civil engineering","Robot or automated system","Yes","Automated system – Other","","","","",""
"Pickle Robot Company","Robots for material handling.","https://picklerobot.com/","https://www.linkedin.com/company/pickle-robot-company/","Warehousing and storage","Robot or automated system","No","Hybrid robotic system,Mobile manipulator,Mobile robot – Wheeled – Indoor,Robotic arm – Articulated","","","","",""
"PickNik Robotics","Software for intuitive robotic arm programming and control.","https://picknik.ai/","https://www.linkedin.com/company/picknik/","Robotic controls,Robotics development","Software","No","","","","","",""
"Pike Robotics","Mobile robots for inspection of floating roof storage tanks.","https://www.pikerobotics.com/","https://www.linkedin.com/company/pike-robotics/","Energy,Inspection,Oil and Gas","Robot or automated system","No","Climbing robot","","","","",""
"Pio","Robotic modular storage system for smaller retailers.","https://pio.com/","https://www.linkedin.com/company/pioautomation/","Retail,Warehousing and storage","Robot or automated system","No","Modular or standardized storage and retrieval system","","","","",""
"Pivot Robotics","Surface-finishing robots with autonomous visual QA.","https://www.pivotrobotics.com/","https://www.linkedin.com/company/pivot-robotics/","Manufacturing","Robot or automated system","Yes","Robotic arm – Articulated","","","","",""
"Pixconvey","Delivery robot.","https://www.pixconvey.net/","https://www.linkedin.com/company/pixconvey/","Delivery","Robot or automated system","No","Mobile robot – Wheeled – Outdoor","","","","",""
"Plus","Autonomous driving software.","https://plus.ai/","https://www.linkedin.com/company/plusai/","Automotive,Transportation,Transportation of goods,Trucking","Software","No","","","","","",""
"Plus One Robotics","Software and equipment for robotic material handling.","https://www.plusonerobotics.com/","https://www.linkedin.com/company/plusone-robotics/https://www.linkedin.com/company/plusone-robotics/","Warehousing and storage","Robot or automated system,Software","No","Automated system – Other","","","","",""
"Point One Navigation","Centimeter-accurate positioning sensors and API.","https://pointonenav.com/","https://www.linkedin.com/company/pointonenav/","Robotics development","Hardware component,Software","No","","","","","",""
"Pollen Robotics","Upper-torso humanoid robot.","https://www.pollen-robotics.com/","https://www.linkedin.com/company/pollen-robotics/","General-purpose robotics","Robot or automated system","No","Humanoid robot – Mobile platform","","","","",""
"Polymath Robotics","Software for autonomous off-road mobility.","https://www.polymathrobotics.com/","https://www.linkedin.com/company/polymath-robotics/","Agriculture and farming,Civil engineering,Construction,Earthworks,Mining,Transportation of goods","Software","No","","","","","",""
"Primordial Labs","Voice and natural language robotic control.","https://www.primordial-labs.com/","https://www.linkedin.com/company/primordial-labs-inc/","Defense,Robotic controls","Software","Yes","","","","","",""
"Progressive Robotics","No-code software for programming and simulating robotic palletizing.","https://progressiverobotics.ai/","https://www.linkedin.com/company/progressive-robotics-ai","Material handling,Robotic controls","Software","No","","","","","",""
"Proxy","Telepresence robot.","https://what-is-proxy.com/","https://www.linkedin.com/company/the-proxy-company/","General-purpose robotics","Robot or automated system","No","","","","","",""
"PX4 Autopilot","Open source autopilot for drone developers.","https://px4.io/","https://www.linkedin.com/company/px4/","Robotics development","Software","No","","","","","",""
"Pyka","Autonomous electric airplanes.","https://www.flypyka.com/","https://www.linkedin.com/company/flypyka/","Agriculture and farming,Aviation,Defense,Delivery,Transportation of goods","Robot or automated system","No","Aerial drone – Fixed-wing","","","","",""
"qbrobotics","Robotic hands.","https://qbrobotics.com/","https://www.linkedin.com/company/qbrobotics/","Robotics development","Hardware component","No","","","","","",""
"Quantum Systems","Drones and cameras for defense intelligence collection.","https://quantum-systems.com/","https://www.linkedin.com/company/quantum-systems-gmbh/","Defense","Hardware component,Robot or automated system","No","Aerial drone – Fixed-wing,Aerial drone – Multirotor","","","","",""
"Raise Robotics","Robotic fastener installation for construction.","http://raiserobotics.ai/","https://www.linkedin.com/company/raise-robotics/","Construction","Robot or automated system","No","Mobile manipulator,Mobile robot – Tracked,Robotic arm – Articulated","","","","",""
"Rapid Robotics","Software for automated material handling.","https://www.rapidrobotics.com/","https://www.linkedin.com/company/rapid-robotics-inc/","Manufacturing,Warehousing and storage","Software","No","","","","","",""
"Reach Robotics","Drones and components for underwater applications.","https://reachrobotics.com/","https://www.linkedin.com/company/reachrobotics/","Defense,Inspection,Marine,Research","Hardware component,Robot or automated system","No","Underwater drone","","","","",""
"Realtime Robotics","Motion planning software for robotic arms.","https://rtr.ai/","https://www.linkedin.com/company/realtimerobotics/","Robotic controls","Software","No","","","","","",""
"Red Cat Holdings","Holdings of multiple defense robotics companies.","https://redcat.red/","https://www.linkedin.com/company/red-cat/","Defense,Security","Robot or automated system","No","Aerial drone – Fixed-wing,Aerial drone – Multirotor","","","","",""
"Red Rabbit Robotics","Open-source humanoid robot.","http://www.redrabbitrobotics.cc/","https://www.linkedin.com/company/red-rabbit-robotics/","General-purpose robotics,Robotics development","Hardware component,Robot or automated system","No","Humanoid robot","","","","",""
"Reflex Robotics","Mobile semi-humanoid robot.","https://www.reflexrobotics.com/","https://www.linkedin.com/company/reflexrobotics/","General-purpose robotics,Material handling","Robot or automated system","No","Humanoid robot – Mobile platform","","","","",""
"Reframe Systems","Robot powered prefab construction.","https://www.reframe.systems/","https://www.linkedin.com/company/reframe-systems/","Construction","Robot-powered service","No","Hybrid robotic system","","","","",""
"Relentless Adrenaline","Research and development of robotics technologies for corporations.","https://relentlessadrenaline.com/","https://www.linkedin.com/company/relentless-adrenaline/","Research","On-demand robotics or automation development,On-demand software development","No","","","","","",""
"Reliable Robotics","Fully autonomous flight software for airplanes.","https://reliable.co/","https://www.linkedin.com/company/reliablerobotics/","Aviation","Autonomous control system","No","","","","","",""
"Renovate Robotics","Robots for roofing.","https://www.renovaterobotics.com/","https://www.linkedin.com/company/renovate-robotics/","Construction","Robot or automated system","No","Cable-driven robot","","","","",""
"Rerun","SDK for building time aware visualizations of multimodal data.","https://rerun.io/","https://www.linkedin.com/company/rerun-io/","Robotics development,Robotics management","Software,Software as a service","Yes","","","","","",""
"Reshape Automation","Online shop for automation systems and service for end-to-end automation installation.","https://www.reshapeautomation.com/","https://www.linkedin.com/company/reshapeautomation/","Manufacturing","On-demand robotics or automation development,Software as a service","No","","","","","",""
"RIF Robotics","Hospital robots for sterile processing.","https://www.rifrobotics.com/","https://www.linkedin.com/company/rifrobotics/","Healthcare","Robot or automated system","No","Robotic arm – Articulated","","","","",""
"RightHand Robotics","Components for robotic material handling.","https://righthandrobotics.com/","https://www.linkedin.com/company/righthand-robotics-inc/","Warehousing and storage","Hardware component","No","","","","","",""
"RobCo","Robotic arms and compatible components.","https://www.robco.de/en","https://www.linkedin.com/company/robco-therobotcompany/","Manufacturing,Material handling","Hardware component,Robot or automated system,Robot-powered service","No","Robotic arm – Articulated","","","","",""
"Roboception GmbH","3D stereo vision cameras for robots.","https://roboception.com/","https://www.linkedin.com/company/roboception-gmbh/","Robotics development","Hardware component","Yes","","","","","",""
"RoboDK","Simulation software and programming for industrial robots.","https://robodk.com/","https://www.linkedin.com/company/robodk/","Robotic controls,Robotics development","Software","No","","","","","",""
"Roboflow","Computer vision tools.","https://roboflow.com/","https://www.linkedin.com/company/roboflow-ai/","Robotics development","Software,Software as a service","No","","","","","",""
"Robosoft","SMACC state machine library for robotics applications.","https://robosoft.ai/","https://www.linkedin.com/company/robosoft-ai2/","Robotics development","Software","No","","","","","",""
"Robot Advisors","Consultancy that helps companies select robotic solutions for their needs.","https://www.robotadvisorygroup.com/","https://www.linkedin.com/company/robot-advisors/about/","Inventory management,Material handling,Robotics management,Warehousing and storage","On-demand service other","Yes","","","","","",""
"Robotec.ai","Simulation tools for ROS2.","http://www.robotec.ai/","https://www.linkedin.com/company/robotec-ai/","Robotics development","Software","No","","","","","",""
"Robotiq","Grippers, sensors etc.","https://robotiq.com/","https://www.linkedin.com/company/robotiq/","Robotics development","Hardware component","No","","","","","",""
"RoboTire","Robots for tire changing.","https://robotire.com/","https://www.linkedin.com/company/robotire/","Car maintenance","Robot or automated system","No","Robotic arm – Articulated","","","","",""
"Robotnik Automation","Mobile robot platforms","http://www.robotnik.eu/","https://www.linkedin.com/company/robotnik-automation/","Robotics development","Robot or automated system","Yes","Mobile manipulator,Mobile robot – Wheeled – Indoor,Mobile robot – Wheeled – Off-road,Mobile robot – Wheeled – Outdoor,Robotic arm – Articulated","","","","",""
"Roboto AI","Service for robotic data management.","https://www.roboto.ai/","https://www.linkedin.com/company/robotoai/","Robotics management","Software as a service","No","","","","","",""
"Robovision","","https://robovision.ai/","https://www.linkedin.com/company/robovisionai/","Robotics development","Software","Yes","","","","","",""
"Robust.AI","Robots for moving materials.","https://www.robust.ai/","https://www.linkedin.com/company/robust-ai/","Manufacturing,Warehousing and storage","Robot or automated system","Yes","Mobile robot – Wheeled – Indoor","","","","",""
"Rover Robotics","Mobile robotic platform for robotic developers, researchers, and engineers.","https://roverrobotics.com/","https://www.linkedin.com/company/rover-robotics/","Robotics development","Robot or automated system","Yes","Mobile robot – Tracked,Mobile robot – Wheeled – Off-road","","","","",""
"Rugged Robotics","Construction layout robots.","https://rugged-robotics.com/","https://www.linkedin.com/company/rugged-robotics/","Construction","Robot or automated system","No","Mobile robot – Wheeled – Indoor","","","","",""
"Sabanto","Autopilot system for tractors.","https://sabantoag.com/","https://www.linkedin.com/company/sabanto/","Agriculture and farming","Autonomous control system","No","Automation retrofit","","","","",""
"Salient Motion","Motor controllers.","https://www.salientmotion.com/","https://www.linkedin.com/company/salient-motion/","Robotic controls,Robotics development","Hardware component","No","","","","","",""
"Sanctuary AI","Robot control system and humanoid robot.","https://sanctuary.ai/","https://www.linkedin.com/company/sanctuaryai/","General-purpose robotics","Autonomous control system,Robot or automated system,Software","Yes","Humanoid robot","","","","",""
"Saronic Technologies","Autonomous maritime surface vehicles.","https://www.saronic.com/","https://www.linkedin.com/company/saronic-technologies/","Defense","Robot or automated system","No","Surface water drone","","","","",""
"Scaled Foundations","General robot intelligence for robots to operate in the physical world.","https://scaledfoundations.ai/","https://www.linkedin.com/company/scaled-foundations/","Robotic controls,Robotics development","Software","Yes","","","","","",""
"Scythe Robotics","Robotic mower.","https://www.scytherobotics.com/","https://www.linkedin.com/company/scythe-robotics/","Landscaping","Robot or automated system","No","Mobile robot – Wheeled – Off-road","","","","",""
"Seasats","Autonomous surface vehicles.","https://www.seasats.com/","https://www.linkedin.com/company/seasats/","Defense,Inspection,Research,Science","Robot or automated system","No","Surface water drone","","","","",""
"Seegrid","Autonomous forklifts.","https://seegrid.com/","https://www.linkedin.com/company/seegrid/","Warehousing and storage","Robot or automated system","Yes","Mobile robot – Wheeled – Indoor","","","","",""
"Segments.ai","Multi-sensor labeling platform for robotics and autonomous driving.","https://segments.ai/","https://www.linkedin.com/company/segmentsai/","Robotics development","Software","Yes","","","","","",""
"Sensei Robotics","Mechanical Turk for robotic training data collection.","https://senseirobotics.com/","https://www.linkedin.com/company/sensei-robotics-yc-s24/","Robotics development","On-demand service other,Software","Yes","","","","","",""
"Septentrio","GNSS receivers.","https://www.septentrio.com/en","https://www.linkedin.com/company/septentrio/","Automotive,Marine,Robotics development,Space,Surveying","Hardware component","No","","","","","",""
"Sereact","AI-powered material handling robots.","https://sereact.ai/","https://www.linkedin.com/company/sereact/","Material handling,Packaging","Software","Yes","","","","","",""
"Serve Robotics","Mobile delivery robots.","https://www.serverobotics.com/","https://www.linkedin.com/company/serverobotics/","Delivery","Robot or automated system","No","Mobile robot – Wheeled – Outdoor","","","","",""
"Sevensense Robotics","Sensors and software that turns mobile ground machines into autonomous robots.","https://www.sevensense.ai/","https://www.linkedin.com/company/sevensense-robotics/","Robotic controls,Robotics development","Autonomous control system,Hardware component","Yes","","","","","",""
