"Elroy Air","Autonomous VTOL delivery drones.","https://elroyair.com/","https://www.linkedin.com/company/elroy-air/","Delivery,Transportation of goods","Robot or automated system","No","Aerial drone – VTOL","","","","",""
"Ember Robotics","Camera diagnostic tools for robots.","https://emberrobotics.com/","https://www.linkedin.com/company/ember-robotics/","Robotics development,Robotics management","Software","No","","","","","",""
"Enchanted Tools","Humanoid robots with a heavy focus on robot’s expressions.","https://enchanted.tools/","https://www.linkedin.com/company/enchantedtools/","General-purpose robotics","Robot or automated system","Yes","Humanoid robot – Mobile platform","","","","",""
"Energy Robotics","Software for inspection robots.","https://www.energy-robotics.com/","https://www.linkedin.com/company/energy-robotics/","Inspection","Software","No","","","","","",""
"Et Cetera Robotics","Software for robotic visual perception.","https://www.etcrobotics.com/","https://www.linkedin.com/company/et-cetera-robotics/","Robotic controls,Robotics development","Software","No","","","","","",""
"Eureka Robotics","Hardware components for high accuracy automation.","https://eurekarobotics.com/","https://www.linkedin.com/company/eurekarobotics/","Robotics development","Hardware component","No","","","","","",""
"Exodigo","Drone-powered subsurface imaging.","https://www.exodigo.com/","https://www.linkedin.com/company/exodigo/","Civil engineering,Energy,Infrastructure,Inspection","Robot-powered service","No","","","","","",""
"Exotec","Warehouse storage system and robots.","https://www.exotec.com/","https://www.linkedin.com/company/exotec/","Warehousing and storage","Robot or automated system","Yes","Climbing robot,Hybrid robotic system,Mobile robot – Wheeled – Indoor,Modular or standardized storage and retrieval system","","","","",""
"Eye-bot","Drone-powered surveying.","https://eye-bot.com/","https://www.linkedin.com/company/eye-bot-aerial-solutions/","Inspection","Robot-powered service","No","","","","","",""
"Fabric","Autonomous warehouse storage and retrieval system.","https://getfabric.com/","https://www.linkedin.com/company/fabriclogistics/","Warehousing and storage","Robot or automated system","No","Hybrid robotic system,Mobile robot – Wheeled – Indoor,Modular or standardized storage and retrieval system","","","","",""
"Farm-ng","Autonomous chassis for farming applications.","https://farm-ng.com/","https://www.linkedin.com/company/farm-ng/","Agriculture and farming","Robot or automated system","No","Mobile robot – Wheeled – Off-road","","","","",""
"FarmWise","Autonomous weeding.","https://farmwiselabs.com/","https://www.linkedin.com/company/farmwise/","Agriculture and farming","Robot or automated system","No","Automated system – Other","","","","",""
"Field AI","Foundation models for robots to understand unstructured settings.","https://fieldai.com/","https://www.linkedin.com/company/fieldai/","Robotic controls,Robotics development","Software","Yes","","","","","",""
"Figure","General-purpose humanoid robot.","https://www.figure.ai/","https://www.linkedin.com/company/figure-ai/","General-purpose robotics","Robot or automated system","No","Humanoid robot","","","","",""
"Firestorm","Defense drones.","https://www.launchfirestorm.com/","https://www.linkedin.com/company/firestorm-labs/","Defense","Robot or automated system","No","Aerial drone – Fixed-wing","","","","",""
"Flexiv Robotics","Robotic arms and other manipulators.","https://flexiv.com/","https://www.linkedin.com/company/flexiv-robotics/","Healthcare,Manufacturing,Product testing,Research","Hardware component,Robot or automated system","Yes","Parallel manipulator,Robotic arm – Articulated","","","","",""
"Floating Robotics","Harvesting and de-leafing robots.","https://www.floatingrobotics.com/","https://www.linkedin.com/company/floating-robotics/","Agriculture and farming","Robot or automated system","Yes","Mobile manipulator,Mobile robot – Wheeled – Indoor,Robotic arm – Articulated","","","","",""
"Flyby Robotics","Autonomous drones optimized for ML applications.","https://www.flybydev.com/","https://www.linkedin.com/company/flyby-robotics/","Robotics development","Robot or automated system","Yes","Aerial drone – Multirotor","","","","",""
"ForceN"," Made-to-measure force-moment sensing.","https://www.forcen.tech/","https://www.linkedin.com/company/forcen/","Robotics development","On-demand hardware component development","No","","","","","",""
"Formant","Data platform for robotics companies.","https://formant.io/","https://www.linkedin.com/company/formantinc/","Robotics development,Robotics management","Software as a service","No","","","","","",""
"Formic","RaaS for material handling.","https://formic.co/","https://www.linkedin.com/company/formic-technologies/","Material handling,Packaging","Robot as a service","No","Robotic arm – Articulated","","","","",""
"Formic Transportsystem","Mobile platforms for swarm transportation of heavy objects.","https://formic-transportsystem.com/en/elementor-561/","https://www.linkedin.com/company/formic-transportsystem/","Material handling,Transportation","Robot or automated system","Yes","Mobile robot – Wheeled – Indoor,Mobile robot – Wheeled – Outdoor","","","","",""
"Fort","Controllers for robots.","https://www.fortrobotics.com/","https://www.linkedin.com/company/fort-robotics/","Robotics development","Hardware component","No","","","","","",""
"Fortem Technologies","","https://fortemtech.com/","https://www.linkedin.com/company/fortem-technologies/","Defense,Robotics development,Security","Hardware component,Robot accessory,Robot or automated system","Yes","Aerial drone – Multirotor","","","","",""
"Forterra","Autonomous system for ground-based movement.","https://www.forterra.com/","https://www.linkedin.com/company/forterra-autonomy/","Defense,Transportation of goods,Trucking","Autonomous control system","No","Automation retrofit","","","","",""
"Four Growers, Inc.","Harvesting robots.","https://fourgrowers.com/","https://www.linkedin.com/company/four-growers-inc/","Agriculture and farming","Robot or automated system","No","Mobile manipulator,Mobile robot – Wheeled – Indoor,Robotic arm – Articulated","","","","",""
"Fourier Intelligence","Humanoids and exoskeletons.","https://fourierintelligence.com/","https://www.linkedin.com/showcase/fourier-rehab/","General-purpose robotics,Healthcare","Human augmentation device,Robot or automated system","No","Humanoid robot","","","","",""
"Fox Robotics","Autonomous forklift.","https://foxrobotics.com/","https://www.linkedin.com/company/foxbots/","Warehousing and storage","Autonomous control system","No","Automation retrofit","","","","",""
"Foxglove","Visualization and observability for robotics developers.","https://foxglove.dev/","https://www.linkedin.com/company/foxglovedev/","Robotics development,Robotics management","Software as a service","No","","","","","",""
"Franka Robotics","Robotic arms.","https://franka.de/","https://www.linkedin.com/company/frankarobotics/","General-purpose robotics,Manufacturing,Research","Robot or automated system","No","Robotic arm – Articulated","","","","",""
"Fulfil","Modular food storage and packing system.","https://www.fulfil.com/","https://www.linkedin.com/company/fulfil-automation/","Food,Warehousing and storage","Robot or automated system","No","Automated system – Other,Hybrid robotic system,Mobile robot – Wheeled – Indoor,Modular or standardized storage and retrieval system","","","","",""
"Gather","Tool to transport crops between picker and packer.","https://www.gather.ag/","","Agriculture and farming","Robot or automated system","No","","","","","",""
"Gather AI","Drone-powered inventory monitoring.","https://www.gather.ai/","https://www.linkedin.com/company/gather-ai/","Warehousing and storage","Robot as a service,Software","No","","","","","",""
"Gecko Robotics","Inspection robots that can get to hard-to-reach spaces.","https://www.geckorobotics.com/","https://www.linkedin.com/company/gecko-robotics/","Defense,Inspection,Marine","Robot or automated system","No","Climbing robot","","","","",""
"Geisel Software","Agency for custom robotics, IOT, automation solutions.","https://geisel.software/","https://www.linkedin.com/company/geiselsoftware/","Agriculture and farming,Defense,Healthcare,Robotics development,Safety,Space","On-demand robotics or automation development","No","","","","","",""
"Genba Robotics","Engineering services for industrial processes automation.","https://genba.uy/en/home","https://www.linkedin.com/company/genbarobotics/","Manufacturing","On-demand robotics or automation development","No","","","","","",""
"Ghost Robotics","Defense robots, robotic dog.","https://www.ghostrobotics.io/","https://www.linkedin.com/company/ghostrobotics/","Defense","Robot or automated system","No","Quadrupedal robot","","","","",""
"GITAI","Robots and rovers for space.","https://gitai.tech/","https://www.linkedin.com/company/gitai/","Space","Robot or automated system","No","Inchworm robot,Planetary rover","","","","",""
"Glacier","Robotic sorting for recycling.","https://endwaste.io/","https://www.linkedin.com/company/endwaste/","Waste management","Robot or automated system","No","Cartesian robot,Hybrid robotic system","","","","",""
"Gravis Robotics","Automated heavy machinery.","https://gravisrobotics.com/","https://www.linkedin.com/company/gravisrobotics/","Civil engineering,Construction,Earthworks,Mining","Autonomous control system","No","Automation retrofit","","","","",""
"GrayMatter Robotics","Surface finishing and treatment robots.","https://graymatter-robotics.com/","https://www.linkedin.com/company/graymatter-robotics/","Automotive,Aviation,Manufacturing,Marine","Robot or automated system","No","Mobile robot – Railed,Robotic arm – Articulated","","","","",""
"Graze Robotics","Mowing robot for large-scale spaces.","https://www.grazemowing.com/","https://www.linkedin.com/company/graze-mowing/","Landscaping","Robot or automated system","No","Mobile robot – Wheeled – Off-road","","","","",""
"Gridstore Robotics GmbH","Modular robotic-powered storage system.","https://www.gridstore.com/en/","https://www.linkedin.com/company/gridstore-robotics/","Warehousing and storage","Robot or automated system","No","Modular or standardized storage and retrieval system","","","","",""
"Groundlight AI","Computer vision for robotics.","https://www.groundlight.ai/","https://www.linkedin.com/company/groundlight-ai/","Robotics development","Software","Yes","","","","","",""
"HAL Robotics","Nocode robot programming.","https://hal-robotics.com/","https://www.linkedin.com/company/hal-robotics-ltd/","Robotic controls,Robotics development","Software","No","","","","","",""
"Haply Robotics","Haptic 3D controller.","https://www.haply.co/","https://www.linkedin.com/company/haplyrobotics/","Research,Robotic controls","Hardware component","No","","","","","",""
"Harmonic Bionics, Inc.","Exoskeletons.","https://harmonicbionics.com/","https://www.linkedin.com/company/harmonic-bionics-inc/","Healthcare","Robot or automated system","No","Automated system – Other","","","","",""
"Harvest Automation","Robots for arranging planters.","https://www.public.harvestai.com/","https://www.linkedin.com/company/harvest-automation-inc./","Agriculture and farming","Robot or automated system","Yes","Mobile robot – Wheeled – Outdoor","","","","",""
"HavocAI","Autonomous water drones for defense.","https://www.havocai.com/","https://www.linkedin.com/company/havocai/","Defense","Robot or automated system","No","Surface water drone","","","","",""
"HEBI Robotics","Modular robotics components.","https://www.hebirobotics.com/","https://www.linkedin.com/company/hebi-robotics/","Robotics development","Hardware component","No","","","","","",""
"Hellbender","Custom component development for robotics.","https://www.hellbender.com/","https://www.linkedin.com/company/hellbender-inc/","Robotics development","Hardware component,On-demand hardware component development","Yes","","","","","",""
"Hello Robot Inc","Mobile manipulator.","https://hello-robot.com/","https://www.linkedin.com/company/hello-robot-inc/","General-purpose robotics","Robot or automated system","Yes","Mobile manipulator,Mobile robot – Wheeled – Indoor,Robotic arm – Cartesian","","","","",""
"Helm.ai","Computer vision for mobility.","https://www.helm.ai/","https://www.linkedin.com/company/helm.ai/","Automotive","Software","Yes","","","","","",""
"Hextronics","Drone nests.","https://hextronics.com/","https://www.linkedin.com/company/hextronics/","Robotics management","Robot accessory","No","","","","","",""
"Hoverfly Technologies","Tethered drones for defense.","https://hoverflytech.com/","https://www.linkedin.com/company/hoverfly/","Defense,Security","Robot or automated system","No","Aerial drone – Multirotor","","","","",""
"Hullbot","Robotic ship hull cleaning.","https://www.hullbot.com/","https://www.linkedin.com/company/hullbot/","Marine","Robot or automated system","No","Underwater drone","","","","",""
"Humotech","Robotic prosthetics and exoskeletons.","https://humotech.com/","https://www.linkedin.com/company/human-motion-technologies-llc/","Healthcare","Human augmentation device","No","","","","","",""
"Husarion","ROS2-powered mobile platforms.","https://husarion.com/","https://www.linkedin.com/company/husarion/","Robotics development","Robot or automated system","Yes","Mobile robot – Wheeled – Outdoor","","","","",""
"Identified Technologies","Drone powered mapping and measuring service service.","https://www.identifiedtech.com/","https://www.linkedin.com/company/identified-technologies/","Construction,Earthworks,Mining,Oil and Gas","Robot-powered service","No","","","","","",""
"InDro Robotics","Drone and ground-based robotic solutions, training, consulting, and R&D for autonomous systems.","https://indrorobotics.ca/","https://www.linkedin.com/company/indro-robotics/","Inspection,Research","On-demand robotics or automation development,Robot-powered service","No","Humanoid robot,Mobile robot – Tracked,Mobile robot – Wheeled – Indoor,Mobile robot – Wheeled – Off-road,Mobile robot – Wheeled – Outdoor,Quadrupedal robot","","","","",""
"Industrial Next","Cameras with computer vision and software for manufacturing automation.","https://industrialnext.ai/en","https://www.linkedin.com/company/industrial-next/","Automotive,Manufacturing","Hardware component,Software","No","","","","","",""
"Industrial Robotics Company","Robotic solutions for woodworking with no-code setup.","https://industrialrobotics.lt/","https://www.linkedin.com/company/industrial-robotics-company/","Manufacturing","Robot or automated system","No","Robotic arm – Articulated","","","","",""
"Innok Robotics","Autonomous mobile robots for various applications.","https://www.innok-robotics.de/en/","https://www.linkedin.com/company/innok-robotics/","General-purpose robotics,Inspection,Landscaping,Robotics development","Autonomous control system,Robot or automated system","Yes","Mobile manipulator,Mobile robot – Tracked,Mobile robot – Wheeled – Off-road,Mobile robot – Wheeled – Outdoor,Robotic arm – Articulated","","","","",""
"Instock.com","Modular automated storage system as a service.","https://instock.com/en/","https://www.linkedin.com/company/instockcom/","Warehousing and storage","Robot as a service","No","Climbing robot,Mobile robot – Wheeled – Indoor,Modular or standardized storage and retrieval system","","","","",""
"Intrinsic","No-code software for programming robots.","https://www.intrinsic.ai/","https://www.linkedin.com/company/intrinsic/","Robotics development,Robotics management","Software","No","","","","","",""
"Invio Automation","","https://www.invioautomation.com/","https://www.linkedin.com/company/invioautomation/","Life sciences,Manufacturing,Pharma,Warehousing and storage","On-demand robotics or automation development","No","","","","","",""
"Jacobi Robotics","Robotic control simplified.","https://jacobirobotics.com/","https://www.linkedin.com/company/jacobi-robotics/","Material handling,Robotic controls,Robotics management","Software,Software as a service","No","","","","","",""
"K-Scale Labs","Open-source software for robotic intelligence and open-source humanoid robot.","https://kscale.dev/","https://www.linkedin.com/company/kscale/","General-purpose robotics","Robot or automated system,Software","No","Humanoid robot","","","","",""
"KABAM Robotics","Mobile security robots and software for robot control.","https://kabam.ai/","https://www.linkedin.com/company/kabam-robotics/","Robotics management,Security","Robot or automated system,Software","No","Mobile robot – Wheeled – Indoor,Mobile robot – Wheeled – Outdoor","","","","",""
"KAIKAKU","Robots for food assembly.","https://www.kaikaku.ai/","https://www.linkedin.com/company/kaikaku-ai/","Food","Robot or automated system,Robot-powered service","No","Automated system – Other","","","","",""
"Karelics","Software for robot fleet management.","https://karelics.fi/","https://www.linkedin.com/company/karelics/","Robotics management","Robot as a service,Software","No","Mobile robot – Wheeled – Indoor,Mobile robot – Wheeled – Outdoor","","","","",""
"KEF Robotics","Visual autonomy for aircraft.","https://www.kefrobotics.com/","https://www.linkedin.com/company/kefrobotics/","Aviation,Defense","Software","No","","","","","",""
"Kepler Exploration Robotics","Humanoid robot.","https://www.gotokepler.com/home","https://www.linkedin.com/company/kepler-exploration-robotics/","General-purpose robotics","Robot or automated system","No","Humanoid robot","","","","",""
"Keybotic","Autonomous robot dogs for industrial inspections.","http://www.keybotic.com/","https://www.linkedin.com/company/keybotic/","Inspection,Research","Robot or automated system","No","Quadrupedal robot","","","","",""
"Kind Humanoid","General-purpose humanoid robots.","https://www.kindhumanoid.com/","https://www.linkedin.com/company/kind-humanoid/","General-purpose robotics","Robot or automated system","No","Humanoid robot","","","","",""
"Kognic","Sensor fusion for autonomous driving.","https://www.kognic.com/","https://www.linkedin.com/company/kognic/","Automotive,Manufacturing,Robotics development","Software","No","","","","","",""
"Kyber Labs","Robotic torso and arms for assembly.","https://kyberlabs.ai/","https://www.linkedin.com/company/kyber-labs/","General-purpose robotics,Manufacturing","Robot or automated system","No","","","","","",""
"Latitude AI","Automated driving technologies.","https://lat.ai/","https://www.linkedin.com/company/latitudeai/","Automotive","Autonomous control system","No","","","","","",""
"Launchpad.build","Machines for automated manufacturing.","https://www.launchpad.build/","https://www.linkedin.com/company/launchpadbuild/","Manufacturing","Robot or automated system","No","Automated system – Other","","","","",""
"Leaficient","AI powered lighting control for indoor farms.","https://www.leaficient.com/","https://www.linkedin.com/company/leaficient/","Agriculture and farming","Robot or automated system","No","Automated system – Other","","","","",""
"LEVA Robotics","All-terrain, autonomous legged robot.","https://leva.ethz.ch/","https://www.linkedin.com/company/leva-robotics/","Delivery,Material handling,Transportation of goods","Robot or automated system","Yes","Quadrupedal robot – Wheeled","","","","",""
"LimX Dynamics","Humanoid, wheeled quadruped and biped robots.","https://www.limxdynamics.com/en","https://www.linkedin.com/company/limx-dynamics/","General-purpose robotics","Robot or automated system","No","Bipedal robot,Humanoid robot,Quadrupedal robot,Quadrupedal robot – Wheeled","","","","",""
"LionsBot International","Autonomous robots for commercial cleaning.","https://www.lionsbot.com/","https://www.linkedin.com/company/lionsbot/","Cleaning","Robot or automated system","No","Mobile robot – Wheeled – Indoor","","","","",""
"Liquid Robotics","Maritime robots.","https://www.liquid-robotics.com/","https://www.linkedin.com/company/liquid-robotics/","Marine","Robot or automated system","No","Surface water drone","","","","",""
"Litmus","Industrial DataOps.","https://litmus.io/","https://www.linkedin.com/company/litmus-automation/","Manufacturing","Software,Software as a service","No","","","","","",""
"Locus Robotics","Warehouse robots.","https://locusrobotics.com/","https://www.linkedin.com/company/locus-robotics/","Healthcare,Manufacturing,Warehousing and storage","Robot or automated system","Yes","Mobile robot – Wheeled – Indoor","","","","",""
"Lumina","Electric autonomous construction equipment.","https://luminatech.co/","https://www.linkedin.com/company/luminatechnologiesinc/","Construction","Robot or automated system","No","","","","","",""
"Luminous","Robotic fleets for solar farm construction.","https://www.luminous.solar/","https://www.linkedin.com/company/luminous-robotics/","Construction,Energy,Solar","Robot-powered service","No","Mobile manipulator,Mobile robot – Wheeled – Off-road,Robotic arm – Articulated","","","","",""
"Lunar Outpost","Rovers for space exploration.","https://www.lunaroutpost.com/","https://www.linkedin.com/company/lunaroutpost/","Space","Robot or automated system","No","Planetary rover","","","","",""
"Machina Labs","Robots that bend sheetmetal.","https://machinalabs.ai/","https://www.linkedin.com/company/machina-labs/","Manufacturing","Robot or automated system,Robot-powered service","No","Robotic arm – Articulated","","","","",""
"Main Street Autonomy","Robot calibration software.","https://mainstreetautonomy.com/","https://www.linkedin.com/company/mainstreetautonomy/","Robotics development,Robotics management","Software,Software as a service","Yes","","","","","",""
"Manifold Robotics","Electromagnetic sensor for drones doing powerline inspection. Computer vision software.","https://www.manifoldrobotics.com/","https://www.linkedin.com/company/manifold-robotics/","Inspection","Hardware component,Software","No","","","","","",""
"Manna Drone Delivery","Drones for delivery.","https://www.manna.aero/","https://www.linkedin.com/company/mannaaero/","Delivery","Robot-powered service","No","Aerial drone – Multirotor","","","","",""
"Mapless AI","Remote driving system.","https://mapless.ai/","https://www.linkedin.com/company/mapless/","Automotive","Robot or automated system","No","Automation retrofit","","","","",""
"Matic Robots","Home mopping and vacuuming robot.","https://maticrobots.com/","https://www.linkedin.com/company/maticrobots/","Cleaning","Robot or automated system","No","Mobile robot – Wheeled – Indoor","","","","",""
"Mecademic","Robotic arms","https://www.mecademic.com/","https://www.linkedin.com/company/mecademic/","General-purpose robotics","Robot or automated system","Yes","Robotic arm – Articulated,Robotic arm – SCARA","","","","",""
"Mech-Mind Robotics","Sensors and software for robots.","https://www.mech-mind.com/","https://www.linkedin.com/company/mechmindrobotics/","Robotic controls,Robotics development","Hardware component,Software","Yes","","","","","",""
"Medra","Robots for life sciences labwork.","https://www.medra.ai/","https://www.linkedin.com/company/medra-ai/","Life sciences,Research","Robot or automated system","No","","","","","",""
"Merlin","Fully autonomous flight software for airplanes.","https://www.merlinlabs.com/","https://www.linkedin.com/company/merlinlabs/","Aviation","Autonomous control system","No","","","","","",""
"Micropsi Industries","AI-powered computer vision for robots","https://www.micropsi-industries.com/","https://www.linkedin.com/company/micropsi-industries/","Robotics development","Software","Yes","","","","","",""
"mimic","Foundational AI model for dexterous robotic manipulation, and robotic hand hardware.","https://www.mimicrobotics.com/","https://www.linkedin.com/company/mimicrobotics/","Robotic controls,Robotics development","Hardware component,Software","Yes","","","","","",""
"Minus Zero","Foundational models for autonomous driving.","https://www.minuszero.ai/","https://www.linkedin.com/company/minuszero/","Automotive","Software","No","","","","","",""
"Miru","Deployment and monitoring stack for robotics.","https://www.miruml.com/","https://www.linkedin.com/company/miruml/","Robotics development,Robotics management","Software as a service","Yes","","","","","",""
"Mission Control","Software for remote asset control.","https://missioncontrolspace.com/","https://www.linkedin.com/company/mission-control-space-services/","Robotic controls,Robotics management,Space","Software","No","","","","","",""
"Mobile Industrial Robots","Mobile robots, forklifts and robotic arms.","https://mobile-industrial-robots.com/","https://www.linkedin.com/company/mobile-industrial-robots-aps/","Manufacturing,Warehousing and storage","Robot or automated system","Yes","Mobile manipulator,Mobile robot – Wheeled – Indoor","","","","",""
"Model-Prime","Data platform for robotics.","https://www.model-prime.com/","https://www.linkedin.com/company/modelprime/","Robotics development,Robotics management","Software,Software as a service","Yes","","","","","",""
"moss","Sensors and software for crop digitizing.","https://www.moss.ag/","https://www.linkedin.com/company/moss-ag/","Agriculture and farming","Robot or automated system","No","Automated system – Other","","","","",""
"Motional","Sensor-software suite for autonomous driving.","https://motional.com/","https://www.linkedin.com/company/motionaldrive/","Delivery,Transportation","Autonomous control system,On-demand robotics or automation development","No","Automation retrofit","","","","",""
